{
  "schemaVersion": 1,
  "chapter": 2,
  "lecture": "2.4",
  "title": "均匀细棒纵振动方程的解",
  "keyPoints": [
    "两端自由细棒的端面应力为零，位移振型为余弦分布。",
    "非零自由振动频率为整数倍 $c/(2L)$，另有 $n=0$ 刚体平移解。",
    "细棒的稳态振动与持续谐和外力同频；左端固定、右端谐和力激励的共振序列为奇数倍 $c/(4L)$。",
    "由两端自由棒的实测基频可求波速和杨氏模量；边界条件必须与计算公式一致。"
  ],
  "sources": [
    {
      "id": "slides",
      "kind": "pdf",
      "file": "2.4均匀细棒纵振动方程的解.pdf",
      "pageCount": 16
    },
    {
      "id": "design-05",
      "kind": "design",
      "file": "第05次课_1019_教学设计.docx",
      "classNumber": 5
    }
  ],
  "reviewNotes": [
    "对齐第5次课目标3—5、65—91分钟。自由—自由非零模态采用余弦分布，n=0为刚体平移，不计入弹性振动基频。",
    "不复用课堂“给棒长、波速求前两个共振频率”，也不复用网站或作业的直接给基频反算模量。数值题改从连续高阶峰的间距识别基频。",
    "无阻尼模型只讨论非共振同频特解；无耗散自由分量不会自行衰减，不能将该特解说成任意初值的最终唯一运动。",
    "深度题对同一根棒更换边界后的材料模量误判作审查，区分真实材料改变和误用反演公式；第一非零纵向模态的识别是前提。",
    "按新增审查要求，post-05改为简答，含3条评分要点和参考答案；未增设可选post-06，仍保持课前3题、课后5题。"
  ],
  "questions": [
    {
      "id": "2.4-pre-01",
      "lecture": "2.4",
      "kind": "pre",
      "role": "prerequisite",
      "level": "基础",
      "concept": ["两端自由细棒的端面应力为零，位移振型为余弦分布。"],
      "type": "single",
      "stem": "某棒的纵位移空间因子为 $\\cos(2\\pi z/L)$，轴向应力满足 $\\sigma=E\\partial_z\\zeta$。其应力空间因子与位移的关系是哪项？",
      "options": [
        {
          "id": "A",
          "text": "仍为 $\\cos(2\\pi z/L)$，所以应力和位移处处成正比"
        },
        {
          "id": "B",
          "text": "是常数，因为材料均匀"
        },
        {
          "id": "C",
          "text": "为 $-\\sin(2\\pi z/L)$，但必须略去求导产生的 $2\\pi/L$ 才有正确单位"
        },
        {
          "id": "D",
          "text": "正比于 $-\\sin(2\\pi z/L)$；求导还带来 $2\\pi/L$，应力与位移的零点不同"
        }
      ],
      "answer": "D",
      "explanation": [
        "A：应力与应变成正比，应变是位移的导数，不是位移本身。",
        "B：均匀材料意味着参数不随位置变化，不意味着振动应力处处相同。",
        "C：空间导数的长度倒数因子必须保留，才能从位移得到无量纲应变。",
        "D：空间求导把余弦变为负正弦；这解释了自由端可为位移腹部而应力为零。"
      ],
      "source": [
        {
          "document": "slides",
          "pages": [3, 4, 9]
        },
        {
          "document": "design-05",
          "section": "二、教学目标3、4、5；五、65—79分钟“两端自由棒的弹性模态”、79—91分钟“力激励棒；共振法测模量”（目标迁移，非课堂题复用）"
        }
      ]
    },
    {
      "id": "2.4-pre-02",
      "lecture": "2.4",
      "kind": "pre",
      "role": "intuition",
      "level": "理解",
      "concept": ["非零自由振动频率为整数倍 $c/(2L)$，另有 $n=0$ 刚体平移解。"],
      "type": "single",
      "stem": "两端自由细棒最初没有形变，整根棒各点都有相同轴向速度 $v_0$。忽略阻尼和外力，随后是否一定会出现周期性的伸缩振动？",
      "options": [
        {
          "id": "A",
          "text": "会，任何非零初速都会激发第一弹性模态"
        },
        {
          "id": "B",
          "text": "不会；可保持均匀平移，不产生应变和弹性恢复力"
        },
        {
          "id": "C",
          "text": "会，平移本身就是最低非零固有频率的振动"
        },
        {
          "id": "D",
          "text": "不会运动，因为两端自由要求初速为零"
        }
      ],
      "answer": "B",
      "explanation": [
        "A：速度空间分布决定模态投影，均匀初速只需零波数分量。",
        "B：$\\zeta(z,t)=v_0t$ 满足自由端与波动方程；它是零频刚体运动，不是周期伸缩。",
        "C：匀速平移不周期变化，不能把它当成最低非零弹性频率。",
        "D：自由端约束应力，并不禁止整体运动或非零初速。"
      ],
      "source": [
        {
          "document": "slides",
          "pages": [3, 6, 9]
        },
        {
          "document": "design-05",
          "section": "二、教学目标3、4、5；五、65—79分钟“两端自由棒的弹性模态”、79—91分钟“力激励棒；共振法测模量”（目标迁移，非课堂题复用）"
        }
      ]
    },
    {
      "id": "2.4-pre-03",
      "lecture": "2.4",
      "kind": "pre",
      "role": "distinction",
      "level": "理解",
      "concept": [
        "非零自由振动频率为整数倍 $c/(2L)$，另有 $n=0$ 刚体平移解。",
        "由两端自由棒的实测基频可求波速和杨氏模量；边界条件必须与计算公式一致。"
      ],
      "type": "single",
      "stem": "近似两端自由的棒在一次敲击后的频谱中，最低可见峰恰好对应第二纵向模态。有人将这个最低可见峰直接叫作该棒的弹性基频。问题在哪里？",
      "options": [
        {
          "id": "A",
          "text": "基频取决于敲击力度，改变力度后就能重新定义"
        },
        {
          "id": "B",
          "text": "所有可见峰都可任意称为基频"
        },
        {
          "id": "C",
          "text": "测点和激发方式可能漏掉第一模态，最低可见峰未必是第一非零固有频率"
        },
        {
          "id": "D",
          "text": "两端自由的棒只有零频平移，不存在非零固有频率"
        }
      ],
      "answer": "C",
      "explanation": [
        "A：在线性小振幅模型中，力度主要改变响应幅值，不能重新定义固有基频。",
        "B：弹性基频特指最低非零固有频率，不能任意挑选可见峰。",
        "C：模态识别须结合测点、振型或峰间隔，不能只按频谱显示的最低峰判断。",
        "D：自由棒既有零频刚体运动，也有无穷多个非零弹性模态。"
      ],
      "source": [
        {
          "document": "slides",
          "pages": [7, 8, 9, 15]
        },
        {
          "document": "design-05",
          "section": "二、教学目标3、4、5；五、65—79分钟“两端自由棒的弹性模态”、79—91分钟“力激励棒；共振法测模量”（目标迁移，非课堂题复用）"
        }
      ]
    },
    {
      "id": "2.4-post-01",
      "lecture": "2.4",
      "kind": "post",
      "role": "concept",
      "level": "理解",
      "concept": [
        "两端自由细棒的端面应力为零，位移振型为余弦分布。",
        "非零自由振动频率为整数倍 $c/(2L)$，另有 $n=0$ 刚体平移解。"
      ],
      "type": "single",
      "stem": "两端自由细棒的初始位移为 $\\zeta(z,0)=a_0+a_2\\cos(2\\pi z/L)$，初速处处为零，且 $a_0,a_2$ 均不为零。哪项正确描述其线性自由响应？",
      "options": [
        {
          "id": "A",
          "text": "常量项保持静态平移偏置，第二模态以 $f_2=c/L$ 振动；本次响应可没有第一模态"
        },
        {
          "id": "B",
          "text": "常量项以 $f_1=c/(2L)$ 振动，余弦项不随时间变化"
        },
        {
          "id": "C",
          "text": "必须把余弦项改成正弦才能满足自由端"
        },
        {
          "id": "D",
          "text": "初始位移既然非零，就不能满足端面零应力"
        }
      ],
      "answer": "A",
      "explanation": [
        "A：常量空间项没有应变；第二阶余弦在两端导数为零，其系数由初始形状确定，未激发的第一阶仍是系统允许的模态。",
        "B：常量项对应零波数和零频；弹性余弦项才会振荡。",
        "C：自由端要求空间导数为零，这里余弦满足条件，不能套用固定弦的正弦振型。",
        "D：端面应力取决于位移导数而非位移值，非零端面位移并不违规。"
      ],
      "source": [
        {
          "document": "slides",
          "pages": [3, 6, 8, 9]
        },
        {
          "document": "design-05",
          "section": "二、教学目标3、4、5；五、65—79分钟“两端自由棒的弹性模态”、79—91分钟“力激励棒；共振法测模量”（目标迁移，非课堂题复用）"
        }
      ]
    },
    {
      "id": "2.4-post-02",
      "lecture": "2.4",
      "kind": "post",
      "role": "formula",
      "level": "理解",
      "concept": [
        "细棒的稳态振动与持续谐和外力同频；左端固定、右端谐和力激励的共振序列为奇数倍 $c/(4L)$。"
      ],
      "type": "single",
      "stem": "左端固定、右端受给定谐和力的棒，其端点同频位移系数为 $F_0\\tan(kL)/(ESk)$。当 $\\omega\\to0$、$k=\\omega/c$ 时，该式怎样回到静力学？",
      "options": [
        {
          "id": "A",
          "text": "位移趋于零，因为分母含 $k$"
        },
        {
          "id": "B",
          "text": "位移无穷大，因为 $k$ 趋于零"
        },
        {
          "id": "C",
          "text": "位移趋于 $F_0/(ESL)$，因为 $\\tan(kL)$ 可直接略去"
        },
        {
          "id": "D",
          "text": "用 $\\tan(kL)\\approx kL$，得到端点位移幅值 $F_0L/(ES)$"
        }
      ],
      "answer": "D",
      "explanation": [
        "A：分子也随波数趋于零，必须联合取极限，不能单独看分母。",
        "B：这是可消去的零比零极限，低频不等于共振极点。",
        "C：略去正切项会漏掉长度因子，且该式位移量纲不符。",
        "D：得到轴向弹簧刚度 $ES/L$ 的静位移，说明波动解的低频极限与集中参数静力学一致。"
      ],
      "source": [
        {
          "document": "slides",
          "pages": [10, 12, 13, 14]
        },
        {
          "document": "design-05",
          "section": "二、教学目标3、4、5；五、65—79分钟“两端自由棒的弹性模态”、79—91分钟“力激励棒；共振法测模量”（目标迁移，非课堂题复用）"
        }
      ]
    },
    {
      "id": "2.4-post-03",
      "lecture": "2.4",
      "kind": "post",
      "role": "calculation",
      "level": "应用",
      "concept": [
        "非零自由振动频率为整数倍 $c/(2L)$，另有 $n=0$ 刚体平移解。",
        "由两端自由棒的实测基频可求波速和杨氏模量；边界条件必须与计算公式一致。"
      ],
      "type": "numeric",
      "stem": "一根均匀细棒近似两端自由，长度 $L=0.80\\,\\mathrm{m}$、体密度 $\\rho=2700\\,\\mathrm{kg/m^3}$。已由振型确认两个相邻的非零纵向模态峰为 $f_a=6.250\\,\\mathrm{kHz}$、$f_b=9.375\\,\\mathrm{kHz}$，不保证最低模态可见。由峰间距求杨氏模量 $E$，填 GPa。",
      "answer": {
        "value": 67.5,
        "unit": "GPa",
        "tolerance": {
          "relative": 0.02
        },
        "calculation": {
          "method": "young-from-free-mode-spacing",
          "formula": "$E=4\\rho L^2(f_b-f_a)^2$",
          "inputs": {
            "L": {
              "value": 0.8,
              "unit": "m"
            },
            "rho": {
              "value": 2700,
              "unit": "kg/m^3"
            },
            "fa": {
              "value": 6.25,
              "unit": "kHz"
            },
            "fb": {
              "value": 9.375,
              "unit": "kHz"
            }
          }
        }
      },
      "explanation": [
        "自由—自由棒的相邻非零模态间距为 $\\Delta f=c/(2L)$，不必把最低可见峰误作基频。",
        "$\\Delta f=3.125\\,\\mathrm{kHz}$，故 $c=2L\\Delta f=5000\\,\\mathrm{m/s}$，$E=\\rho c^2=67.5\\,\\mathrm{GPa}$；两峰在该模型中分别为第二、第三阶。"
      ],
      "source": [
        {
          "document": "slides",
          "pages": [7, 8, 15]
        },
        {
          "document": "design-05",
          "section": "二、教学目标3、4、5；五、65—79分钟“两端自由棒的弹性模态”、79—91分钟“力激励棒；共振法测模量”（目标迁移，非课堂题复用）"
        }
      ]
    },
    {
      "id": "2.4-post-04",
      "lecture": "2.4",
      "kind": "post",
      "role": "reasoning",
      "level": "理解",
      "concept": [
        "细棒的稳态振动与持续谐和外力同频；左端固定、右端谐和力激励的共振序列为奇数倍 $c/(4L)$。"
      ],
      "type": "single",
      "stem": "研究左端固定、右端谐和力驱动棒的无阻尼同频特解。在最低共振的两侧选取两个很近的非共振频率，端点系数 $F_0\\tan(kL)/(ESk)$ 从正变负。应怎样解释？",
      "options": [
        {
          "id": "A",
          "text": "负系数说明位移幅值为负，响应没有物理意义"
        },
        {
          "id": "B",
          "text": "负系数表示端点位移相对驱动力反相；精确共振处该有限同频特解不存在"
        },
        {
          "id": "C",
          "text": "负系数说明材料杨氏模量已变成负值"
        },
        {
          "id": "D",
          "text": "负系数说明振动频率从驱动频率改成自由棒基频"
        }
      ],
      "answer": "B",
      "explanation": [
        "A：幅值可取系数的绝对值，符号由相位承载，负系数本身不矛盾。",
        "B：跨过分母零点发生符号翻转，余弦系数变号等价于相差半周期；无阻尼精确极点不能赋有限稳态幅值。",
        "C：符号改变来自频率响应的正切因子，并不要求材料模量变号。",
        "D：同频特解始终与谐和驱动力同频，不能因系数变号而改变频率。"
      ],
      "source": [
        {
          "document": "slides",
          "pages": [10, 11, 13, 14, 15]
        },
        {
          "document": "design-05",
          "section": "二、教学目标3、4、5；五、65—79分钟“两端自由棒的弹性模态”、79—91分钟“力激励棒；共振法测模量”（目标迁移，非课堂题复用）"
        }
      ]
    },
    {
      "id": "2.4-post-05",
      "lecture": "2.4",
      "kind": "post",
      "role": "depth",
      "level": "深度",
      "concept": [
        "非零自由振动频率为整数倍 $c/(2L)$，另有 $n=0$ 刚体平移解。",